{
  "schema_version": "pairwise-compatibility-rules/v0.1",
  "last_reviewed": "2026-06-18",
  "severity_order": ["pass", "advisory", "marginal", "block", "unknown"],
  "substance_classes": {
    "ascorbic_acid": ["antioxidant", "redox_active", "weak_acid"],
    "beta_alanine": ["primary_amine", "amino_acid"],
    "betaine_anhydrous": ["zwitterion"],
    "citric_acid": ["weak_acid", "chelator"],
    "trisodium_citrate": ["citrate", "chelator", "buffer_salt"],
    "copper_tbcc": ["transition_metal", "copper_source", "polyvalent_cation"],
    "creatine_monohydrate": ["guanidino", "amine_like"],
    "d_ribose": ["reducing_sugar", "pentose"],
    "dextrose": ["reducing_sugar", "hexose"],
    "dextrose_monohydrate": ["reducing_sugar", "hexose"],
    "glycerin": ["polyol", "humectant"],
    "l_arginine": ["primary_amine", "amino_acid", "basic_amino_acid"],
    "l_carnitine_l_tartrate": ["tartrate", "zwitterion"],
    "l_citrulline": ["primary_amine", "amino_acid"],
    "l_glutamine": ["primary_amine", "amino_acid", "amide"],
    "l_phenylalanine": ["primary_amine", "amino_acid"],
    "l_tyrosine": ["primary_amine", "amino_acid", "phenolic"],
    "n_acetylcysteine": ["thiol", "redox_active"],
    "taurine": ["amine_sulfonate", "amine_like"],
    "potassium_sorbate": ["preservative", "sorbate"],
    "mct_oil": ["oil_phase_active", "lipid"]
  },
  "rules": [
    {
      "rule_id": "PW-MAILLARD-REDUCING-SUGAR-PRIMARY-AMINE-001",
      "version": 1,
      "status": "active",
      "a": {"class": "reducing_sugar"},
      "b": {"class": "primary_amine"},
      "phase_contexts": ["wet_stored", "concentrate"],
      "mechanism": "Maillard/browning and potency drift in high-aw stored aqueous matrix.",
      "severity": "marginal",
      "confidence": "medium",
      "mitigations": ["dry separation", "same-day reconstitution", "lower pH within validated window", "colorimetry/HPLC stability assay"],
      "downgrade_contexts": {"dry": "pass", "capsule_premix": "advisory", "make_fresh": "advisory", "reconstituted_drink": "advisory"},
      "validation": ["colorimetry", "HPLC/potency", "real-time/stress stability"],
      "source_refs": ["artifacts/compat-improvement-research-20260618/03-pairwise-incompatibility-matrix.md", "artifacts/compat-improvement-research-20260618/topics-03-05-pairwise-redox.md", "calculated-stats-card-v3-upgraded.md"]
    },
    {
      "rule_id": "PW-RIBOSE-ASCORBATE-REDOX-001",
      "version": 1,
      "status": "active",
      "a": {"key": "d_ribose"},
      "b": {"key": "ascorbic_acid"},
      "phase_contexts": ["wet_stored", "concentrate"],
      "mechanism": "Wet ribose + ascorbate co-loss/browning risk; rates are matrix-specific.",
      "severity": "marginal",
      "confidence": "medium",
      "mitigations": ["split dry activator", "make fresh and discard same day", "opaque/low-O2 packaging", "HPLC ascorbate/DHAA assay"],
      "downgrade_contexts": {"dry": "pass", "capsule_premix": "advisory", "make_fresh": "advisory", "reconstituted_drink": "advisory"},
      "validation": ["HPLC ascorbate/DHAA", "colorimetry", "stress + real-time stability"],
      "source_refs": ["artifacts/compat-improvement-research-20260618/topics-03-05-pairwise-redox.md", "omx_wiki/substance-ascorbic-acid-vitamin-c.md"]
    },
    {
      "rule_id": "PW-ASCORBATE-TRANSITION-METAL-001",
      "version": 1,
      "status": "active",
      "a": {"key": "ascorbic_acid"},
      "b": {"class": "transition_metal"},
      "phase_contexts": ["wet_stored", "concentrate", "make_fresh", "reconstituted_drink"],
      "mechanism": "Metal-catalysed ascorbate oxidation, amplified by O2 and light.",
      "severity": "block",
      "confidence": "high",
      "mitigations": ["remove transition metal from wet SKU", "supplier CoA metal limits", "chelator with residual-risk caveat", "opaque/low-O2 packaging"],
      "downgrade_contexts": {"dry": "advisory", "capsule_premix": "advisory", "make_fresh": "marginal", "reconstituted_drink": "marginal"},
      "validation": ["HPLC ascorbate/DHAA", "metal assay", "dissolved oxygen", "light/packaging stress"],
      "source_refs": ["compat/redox.py", "artifacts/compat-improvement-research-20260618/topics-03-05-pairwise-redox.md"]
    },
    {
      "rule_id": "PW-THIOL-TRANSITION-METAL-O2-001",
      "version": 1,
      "status": "active",
      "a": {"class": "thiol"},
      "b": {"class": "transition_metal"},
      "phase_contexts": ["wet_stored", "concentrate", "make_fresh", "reconstituted_drink"],
      "mechanism": "Thiol oxidation/disulfide formation catalysed by transition metals and oxygen.",
      "severity": "block",
      "confidence": "medium",
      "mitigations": ["dry separation", "exclude O2", "remove transition metals", "assay reduced thiol/disulfide"],
      "downgrade_contexts": {"dry": "advisory", "capsule_premix": "advisory", "make_fresh": "marginal", "reconstituted_drink": "marginal"},
      "validation": ["reduced thiol/disulfide assay", "metal assay", "dissolved oxygen"],
      "source_refs": ["artifacts/compat-improvement-research-20260618/topics-03-05-pairwise-redox.md", "omx_wiki/substance-nac-n-acetylcysteine.md"]
    },
    {
      "rule_id": "PW-CITRATE-TRANSITION-METAL-CHELATION-CAVEAT-001",
      "version": 1,
      "status": "active",
      "a": {"class": "chelator"},
      "b": {"class": "transition_metal"},
      "phase_contexts": ["wet_stored", "concentrate", "make_fresh", "reconstituted_drink"],
      "mechanism": "Chelation can lower free metal but does not prove redox inactivity.",
      "severity": "advisory",
      "confidence": "high",
      "mitigations": ["calculate chelator:metal molar ratio", "verify residual redox activity experimentally"],
      "downgrade_contexts": {"dry": "pass", "capsule_premix": "advisory"},
      "validation": ["metal speciation/assay", "redox challenge"],
      "source_refs": ["compat/redox.py", "artifacts/compat-improvement-research-20260618/topics-03-05-pairwise-redox.md"]
    },
    {
      "rule_id": "PW-OIL-PHASE-AQUEOUS-ACTIVE-001",
      "version": 1,
      "status": "active",
      "a": {"class": "oil_phase_active"},
      "b": {"class": "weak_acid"},
      "phase_contexts": ["oil_emulsion"],
      "mechanism": "Oil/water phase partitioning can hide aqueous-active dose and raise emulsion validation burden.",
      "severity": "advisory",
      "confidence": "low",
      "mitigations": ["validate emulsion", "assay dose uniformity by phase", "use appropriate surfactant system"],
      "downgrade_contexts": {"dry": "pass", "wet_stored": "pass", "make_fresh": "pass", "reconstituted_drink": "pass"},
      "validation": ["dose uniformity", "droplet size", "phase separation"],
      "source_refs": ["artifacts/compat-improvement-research-20260618/03-pairwise-incompatibility-matrix.md"]
    }
  ]
}
